[
  {
    "lesson_no": 1,
    "title": "课程导入与电路模型",
    "hours": 2,
    "objectives": {
      "knowledge": [
        "说明电路模型的基本含义"
      ],
      "ability": [
        "能够区分实际器件与理想元件模型"
      ],
      "literacy": [
        "形成工程抽象和规范表达意识"
      ]
    },
    "key_points": [
      "电路模型",
      "理想元件",
      "参考方向"
    ],
    "difficult_points": [
      "模型适用条件",
      "参考方向的工程含义"
    ],
    "activities": [
      "实际电路图片导入",
      "模型抽象小练习"
    ],
    "assessment": [
      "课堂提问",
      "课后练习"
    ],
    "source_ids": [
      "SRC-CIR-001"
    ]
  }
]